{
  "schema_version": "1.0", "protocol": "koni.parity-actions.v1", "case_id": "KPAR-TUI-0001",
  "isolation": {"temporary_project": true, "temporary_pi_home": true, "network": "disabled", "live_projects": false},
  "actions": [
    {"id": "S01-create", "op": "project.create", "args": {"seed": "populated-active-run"}},
    {"id": "S02-roomy", "op": "tui.resize", "args": {"columns": 180, "rows": 52}},
    {"id": "S03-capture-roomy", "op": "capture.collect", "args": {"checkpoint": "C01-roomy", "surfaces": ["tui", "run_state", "agents", "events"]}},
    {"id": "S04-compact", "op": "tui.resize", "args": {"columns": 100, "rows": 30}},
    {"id": "S05-capture-compact", "op": "capture.collect", "args": {"checkpoint": "C02-compact", "surfaces": ["tui", "run_state"]}}
  ]
}
