{
  "schema_version": "1.0", "protocol": "koni.parity-actions.v1", "case_id": "KPAR-GIT-0001",
  "isolation": {"temporary_project": true, "temporary_pi_home": true, "network": "disabled", "live_projects": false},
  "actions": [
    {"id": "S01-create", "op": "project.create", "args": {"seed": "completed-run"}},
    {"id": "S02-capture-ready", "op": "capture.collect", "args": {"checkpoint": "C01-ready", "surfaces": ["run_state", "git", "worktrees"]}},
    {"id": "S03-merge", "op": "run.merge", "args": {"run": "current", "target": "bound"}},
    {"id": "S04-capture-merged", "op": "capture.collect", "args": {"checkpoint": "C02-merged", "surfaces": ["run_state", "git", "worktrees", "receipts"]}}
  ]
}
