{
  "schema_version": "1.0", "protocol": "koni.parity-actions.v1", "case_id": "KPAR-TKT-0001",
  "isolation": {"temporary_project": true, "temporary_pi_home": true, "network": "fixture_only", "live_projects": false},
  "actions": [
    {"id": "S01-create", "op": "project.create", "args": {"seed": "single-implementation-ticket"}},
    {"id": "S02-submit", "op": "ticket.submit", "args": {"output": "first-fixture"}},
    {"id": "S03-compile", "op": "compiler.compile", "args": {"scope": "ticket"}},
    {"id": "S04-fail", "op": "ticket.review", "args": {"verdict": "fail", "reason": "fixture defect"}},
    {"id": "S05-resubmit", "op": "ticket.submit", "args": {"output": "corrected-fixture"}},
    {"id": "S06-pass", "op": "ticket.review", "args": {"verdict": "pass"}},
    {"id": "S07-close", "op": "ticket.close", "args": {"ticket": "current"}},
    {"id": "S08-capture", "op": "capture.collect", "args": {"checkpoint": "C01-closed", "surfaces": ["graph", "tickets", "receipts", "events", "git"]}}
  ]
}
