{
  "schema_version": "1.0", "protocol": "koni.parity-actions.v1", "case_id": "KPAR-BRK-0001",
  "isolation": {"temporary_project": true, "temporary_pi_home": true, "network": "disabled", "live_projects": false},
  "actions": [
    {"id": "S01-create", "op": "project.create", "args": {"seed": "authorized-worker-attempt"}},
    {"id": "S02-valid", "op": "broker.call", "args": {"tool": "record_note", "grant": "exact", "expected_state": "exact", "nonce": "n1"}},
    {"id": "S03-replay", "op": "broker.replay", "args": {"nonce": "n1"}, "expect_error": "replay"},
    {"id": "S04-stale", "op": "broker.call", "args": {"tool": "record_note", "expected_state": "stale", "nonce": "n2"}, "expect_error": "state mismatch"},
    {"id": "S05-terminal", "op": "agent.complete", "args": {"attempt": "current"}},
    {"id": "S06-capture", "op": "capture.collect", "args": {"checkpoint": "C01-enforced", "surfaces": ["grants", "receipts", "run_state", "filesystem"]}}
  ]
}
