{
  "schema_version": "1.0", "protocol": "koni.parity-actions.v1", "case_id": "KPAR-SCH-0002",
  "isolation": {"temporary_project": true, "temporary_pi_home": true, "network": "fixture_only", "live_projects": false},
  "actions": [
    {"id": "S01-create", "op": "project.create", "args": {"seed": "ready-ticket"}},
    {"id": "S02-dispatch", "op": "authority.tick", "args": {"until": "attempt_running"}},
    {"id": "S03-complete", "op": "agent.complete", "args": {"attempt": "current", "result": "valid-fixture"}},
    {"id": "S04-reconcile", "op": "compiler.reconcile", "args": {"attempt": "current"}},
    {"id": "S05-capture", "op": "capture.collect", "args": {"checkpoint": "C01-reconciled", "surfaces": ["tickets", "agents", "events", "usage"]}}
  ]
}
