{
  "schema_version": "1.0", "protocol": "koni.parity-actions.v1", "case_id": "KPAR-RES-0001",
  "isolation": {"temporary_project": true, "temporary_pi_home": true, "network": "disabled", "live_projects": false},
  "actions": [
    {"id": "S01-create", "op": "project.create", "args": {"seed": "reference/parity/fixtures/formulation"}},
    {"id": "S02-install", "op": "project.install_profile", "args": {"profile": "research"}},
    {"id": "S03-compile", "op": "compiler.compile", "args": {"scope": "full"}},
    {"id": "S04-capture", "op": "capture.collect", "args": {"checkpoint": "C01-compiled", "surfaces": ["graph", "tickets", "receipts", "reports"]}}
  ]
}
