{
  "schema_version": "1.0", "protocol": "koni.parity-actions.v1", "case_id": "KPAR-CFG-0003",
  "isolation": {"temporary_project": true, "temporary_pi_home": true, "network": "disabled", "live_projects": false},
  "actions": [
    {"id": "S01-create", "op": "project.create", "args": {"git": true, "seed_run_state": true}},
    {"id": "S02-overlay", "op": "config.write_overlay", "args": {"resource": "run-types/small", "marker": "project-owned"}},
    {"id": "S03-upgrade", "op": "project.upgrade_profile", "args": {"profile": "software", "baseline": "next-fixture"}},
    {"id": "S04-capture", "op": "capture.collect", "args": {"checkpoint": "C01-upgraded", "surfaces": ["profile", "config", "filesystem", "run_state"]}}
  ]
}
