{
  "schema_version": "1.0", "protocol": "koni.parity-actions.v1", "case_id": "KPAR-RUN-0001",
  "isolation": {"temporary_project": true, "temporary_pi_home": true, "network": "disabled", "live_projects": false},
  "actions": [
    {"id": "S01-create", "op": "project.create", "args": {"git": true}},
    {"id": "S02-branch", "op": "git.create_branch", "args": {"name": "feature/recent", "activity": "recent"}},
    {"id": "S03-run", "op": "run.create", "args": {"run_type": "small", "target_ref": "feature/recent", "goal": "change fixture"}},
    {"id": "S04-capture", "op": "capture.collect", "args": {"checkpoint": "C01-created", "surfaces": ["run_state", "git", "worktrees", "filesystem"]}}
  ]
}
