{
  "schema_version": "1.0", "protocol": "koni.parity-actions.v1", "case_id": "KPAR-LIF-0002",
  "isolation": {"temporary_project": true, "temporary_pi_home": true, "network": "fixture_only", "live_projects": false},
  "actions": [
    {"id": "S01-create", "op": "project.create", "args": {"seed": "active-parallel-run"}},
    {"id": "S02-delete", "op": "run.delete", "args": {"run": "current"}},
    {"id": "S03-tick", "op": "authority.tick", "args": {"until": "deletion_acknowledged"}},
    {"id": "S04-capture", "op": "capture.collect", "args": {"checkpoint": "C01-deleted", "surfaces": ["run_state", "agents", "grants", "sessions", "usage", "filesystem", "processes"]}}
  ]
}
